{
  "kind": "tool-profile",
  "schema_version": "1.0",
  "id": "synthetic-local-engine",
  "version": "v001",
  "profile_type": "tool",
  "adapter_type": "local-http",
  "runtime_type": "python",
  "offline_capability": "yes",
  "deterministic_seed_support": true,
  "control_capabilities": ["seed", "text-prompt", "workflow"],
  "minimum_vram_gb": 8,
  "minimum_ram_gb": 16,
  "supported_operating_systems": ["linux", "windows"],
  "install_state": "uninstalled",
  "evidence_references": [
    {
      "source_url": "https://example.invalid/evidence/synthetic-engine",
      "retrieved_at": "2026-08-02",
      "claim": "Synthetic fixture evidence only."
    }
  ],
  "license_evidence_state": "reviewing",
  "commercial_use_review_state": "unreviewed",
  "decision_state": "reviewing"
}
